Duration (in seconds),Finished,RecordedDate,ResponseId,LocationLatitude,LocationLongitude,UserLanguage,Q_RecaptchaScore,Q0_ProlificID,Q1,Q2,Q3,Q4,Q4_5_TEXT,Q5,Q6,Q7,Q7_4_TEXT,Q8,Q8_5_TEXT,Q9,Q9_9_TEXT,Q10_1,Q11,Q11_7_TEXT,Q12,Q13,Q13_7_TEXT,Q14,Q15,Q16 ,Q17,Q17_1_TEXT,Q18,Q19,Q20,Q21,Q21_5_TEXT,Q22,Q23,Q24,Q24_4_TEXT,Q25,Q25_5_TEXT,Q26,Q26_9_TEXT,Q27_1,Q28,Q28_7_TEXT,Q29,Q30,Q30_7_TEXT,Q31,Q32,Q33,Q34,Q34_1_TEXT,Q35,Q36,Q37,Q38,Q39_1,Q40_1
449,True,7/30/25 13:38,R_2q2mpwqDj51Avhi,"51,3703","0,0137",EN,"0,8000000119",677e7a411cbcd54ed0c8f545,Yes,"The head of our IT group in our company gave a talk not long ago. It took place at a venue in the city of London often used for our conferences. We talked about ""when"" and not ""if"" our company will be affected by cybersecurity issues. Perhaps the conversation was formulated that way to remind the employees that they need to be extra vigilant. The conversation and presentation is a regular meeting in town. It lasted two hours. 
I recall people asking questions regarding use of personal emails to send and receive files to their work emails. ",100,Colleague,,Other,"Yes, somebody I know",Workplace/University,,"Personal experience (e.g., cybersecurity incident),Work/school-related requirement,Someone asked for advice",,"Application areas (web browsing, smartphone, social media etc.),Identity theft or fraud,Incidents (ransomware attack, data breach, leak, device theft etc.),Phishing or scams,Privacy tools (permission manager, cookie banners etc.),Security behavior (choice of passwords, updating software etc.),Security tools (password managers, antivirus, VPN etc.)",,5 (Strongly agree),"Interested/curious,Confident/informed,Helpful/responsible",,Many of the issues discussed are the ones I have been aware of for a number of years. I felt my ideas and precautions were legitimate and supported by the IT leader. ,"Interested/curious,Worried/anxious,Confident/informed,Helpful/responsible",,As the head of IT security the other person was worried that the newcomers to the company may not feel that these security issues are as important as they really are,No,,,,No,,,,,,,,,,,,,,,,,,,,,,,,61,Male,Great Britain,Health care ,3,5 (Strongly agree)
537,True,7/30/25 13:39,R_87NZYbSBLstKMcW,"55,9495","-3,1983",EN,"0,8999999762",67757fa143d924c6cb043f46,Yes,"I was speaking to my partner about cybersecurity as we were driving on a recent road trip we took. We spoke about the use of AI to plan day-to-day activities and bigger events such as holidays. We spoke about how when we asked the AI chatbot to tell us what it knew about us, it was slightly alarming how it responded. The conversation was triggered when using chatbots to give us ideas on what we could do on the trip we were on. The conversation lasted around 10 minutes. I remember being concerned and wary of using personally identifying information when asking advice or seeking recommendations to try and keep myself as anonymous as possible.",1,Friend,,Myself,No,Other (please specify),Car,"Personal experience (e.g., cybersecurity incident)",,"Incidents (ransomware attack, data breach, leak, device theft etc.),Other (please specify)",AI bots,3,"Interested/curious,Worried/anxious",,I was curious to know how much information AI was able to share about myself and concerned about how well it was able to interpret the searches I had made into an overall picture of myself. I was relieved that it seemed to know less about me than my partner!,Indifferent,,They are very laid back as a person,No,,,,No,,,,,,,,,,,,,,,,,,,,,,,,30,Female,UK,Education,4,5 (Strongly agree)
534,True,7/30/25 13:39,R_8hXV7dzhbe3hHj7,"54,8021","-1,4376",EN,"0,8999999762",60a96f55b7ab20ce0ac1b365,Yes,I talked with my wife about the importance of not clicking on social media and email links. It was over lunch when we went for a pizza. My wife is click happy on links and is very trusting. If she can see it on facebook then it must be ok. We talked about not clicking links. A guy at work clicked on a link that looked good but it was a phishing attack. He had to go to a disciplinary interview (outcome not known). I was able to provide an example from my phone of a link that looked good but it was a phishing link. At first my wife was sceptical but became convinced after talking. I guess it lasted about 10 minutes.  ,2,Other (please specify),Wife,Myself,No,Other (please specify),Puzza cafe,"Personal experience (e.g., cybersecurity incident),Work/school-related requirement,Other (please specify)",she has clicked on links before ,"Application areas (web browsing, smartphone, social media etc.),Identity theft or fraud,Phishing or scams",,5 (Strongly agree),"Interested/curious,Worried/anxious,Confident/informed,Annoyed,Helpful/responsible",,She initially wasnt worried which made me angry and worried but gradually accepted ,"Interested/curious,Worried/anxious,Annoyed,Indifferent",,She initially didnt think there was a problem but eventually came round to the fact that there was ,Yes,she styopped clicking on links - or asks me first!,,,No,,,,,,,,,,,,,,,,,,,,,,,,64,Male,England,Civil Servant ,3,5 (Strongly agree)
545,True,7/30/25 13:39,R_2GVX6MbYBp2avU6,"51,489","-0,1696",EN,"0,8999999762",5f4b9740fdda0b04d86a533c,Yes,"Speaking with my mother, in the kitchen, making coffee and scones, discussing an article I'd read on BBC News site about how commonplace cyber attacks on UK businesses are, how vulnerable businesses, even large ones (Marks and Spencer, Harrods...) and often pay ransoms rather than reporting the crime. My mother remembered watching on the news about data breaches and customer information being stolen. The conversation lasted 5 minutes, part of a wider discussion about integrity, morals, ethics, political and business leaders.",2,Other (please specify),Mother,Myself,No,At home,,News story or social media post,,"Incidents (ransomware attack, data breach, leak, device theft etc.)",,3,"Interested/curious,Worried/anxious,Annoyed",,"Upsetting to see the rise in crime, how people behave, coarsening ","Interested/curious,Worried/anxious,Annoyed",,"Shared concern about ethics, morals, standards, how people treat each other, widening wealth inequality...",No,,,,No,,,,,,,,,,,,,,,,,,,,,,,,40,Male,United Kingdom,Manager (retail),1 (Strongly disagree),5 (Strongly agree)
565,True,7/30/25 13:39,R_3DcpqV1OXtgSz6u,"35,0221","-80,5318",EN,"0,8999999762",650b03136ab3d4c832d98b71,Yes,"My mothers Amazon account was hacked about 2 months ago. I went to her house, and we talked about how to get her account back and how to improve her account security so that it does not get hacked again. The conversation lasted about 1 hour, where we were trying to figure out why she was being charged for things she never ordered. I then helped her change all of her passwords. We also talked about different ways that hackers could have gotten access to her account like sending a phishing email or a website link to her text messages.",1,Other (please specify),Mother,Other,No,Other (please specify),My mothers home,"Personal experience (e.g., cybersecurity incident)",,"Application areas (web browsing, smartphone, social media etc.),Identity theft or fraud,Phishing or scams,Security behavior (choice of passwords, updating software etc.)",,4,"Worried/anxious,Annoyed",,I felt annoyed that her account was hacked and it felt like we couldn't do much after the fact.,Worried/anxious,,She felt worried that she might lose a lot of money and her account if nothing is done about it.,Yes,She is now more careful with her online behavior and changes her passwords more frequently.,,,No,,,,,,,,,,,,,,,,,,,,,,,,31,Male,United States,secondary education teacher,5 (Strongly agree),5 (Strongly agree)
359,True,7/30/25 13:40,R_8Lkgjr7hVdsFjQY,"41,1459","-8,6169",EN,1,5c7c3a866fa756000182443e,Yes,"I talked about cybersecurity with my co-workers, at our lunch break. we were talking about using file sharing platforms like wetransfer, when sending confidential or more sensitive information documents. what triggered it was the update of terms & services from this company and others. we talked for a few moments about it, discussing if the files would indeed stay safe and if there were any other alternatives ",2,Colleague,,Myself,No,Workplace/University,,Work/school-related requirement,,"Incidents (ransomware attack, data breach, leak, device theft etc.)",,4,Interested/curious,,I was interested in discussing the topic and hearing my colleagues opinions ,Interested/curious,,they were interested in sharing their opinions too ,No,,,,No,,,,,,,,,,,,,,,,,,,,,,,,29,Female,Portugal,graphic designer,3,5 (Strongly agree)
392,True,7/30/25 13:40,R_8rH7rOWneEYmXLw,"39,5381","-0,4768",EN,"0,8999999762",5965025e0a12c000010998c7,Yes,The last time I talked about cybersecurity was on a Zoom call with my project team. We were discussing the safety regarding collecting mental health measures via online surveys and how secure they were. We talked about this for about 30 minutes and discussed data encryption and passwords. It was useful to think about how to best protect our participants' data.,5,Colleague,,Other,"Yes, somebody I know",Workplace/University,,"Work/school-related requirement,Someone asked for advice",,"Incidents (ransomware attack, data breach, leak, device theft etc.),Privacy tools (permission manager, cookie banners etc.),Security behavior (choice of passwords, updating software etc.),Security tools (password managers, antivirus, VPN etc.)",,3,"Confident/informed,Helpful/responsible",,it is useful to discuss topics that are important to participant safety,Helpful/responsible,,I think everyone on the team wants our participants to feel safe,No,,"No, but I plan to have one in the future",,No,,,,,,,,,,,,,,,,,,,,,,,,33,Female,Spain,researcher,2,5 (Strongly agree)
354,True,7/30/25 13:40,R_8l6CsqQYy9Noabf,"51,5081","-0,1278",EN,1,5f6ce7a067864711ebb0f66e,Yes,"Myself and my manager were discussing GDPR in the office after an email request from someone came in regarding an order placed by a relative of theirs. My manager and I briefly discussed this and concluded that we could not share any details with them, and that if it needed to be discussed, the person who made the order needed to contact us, which we relayed to the person who initially contacted us. The conversation probably lasted a few minutes.",2,"Colleague,Stranger",,Other,No,Workplace/University,,Work/school-related requirement,,"Surveillance or data collection (government, companies etc.)",,3,Helpful/responsible,,"Although I could not directly assist the person who initially contacted us, I did provide a way in which the issue could be resolved.",Indifferent,,"My response was not a massive inconvenience to them, and I helped as much as I was able to.",No,,"Yes, I had (How many?)",1,No,,,,,,,,,,,,,,,,,,,,,,,,24,Female,United Kingdom,Box Office Supervisor,3,5 (Strongly agree)
377,True,7/30/25 13:41,R_2VVUzUVyj2BT4Xv,"51,7694","-2,3329",EN,"0,8999999762",57811ce809fb910001335702,Yes,"- Myself and another engineer
-At work
- A potential issue we had on our platform that could have caused a security issue.
- Something found during security testing
- 10-15 minutes
- We discussed what was required to further investigate and fix the issue.  
",2,Colleague,,Other,"Yes, somebody I know",Workplace/University,,Work/school-related requirement,,"Incidents (ransomware attack, data breach, leak, device theft etc.)",,4,"Interested/curious,Confident/informed,Helpful/responsible",,Because its part of my job,"Interested/curious,Confident/informed",,They are experienced engineers.  ,Yes,We updated our security on our platform to avoid potential attacks ,"No, but I plan to have one in the future",,No,,,,,,,,,,,,,,,,,,,,,,,,40,Female,United Kingdom,Quality Assurance Manager,2,5 (Strongly agree)
285,True,7/30/25 13:41,R_8YghvjqhIFwElX2,"38,6821","-9,162",EN,"0,6000000238",5f6495def933d1021b49e3da,Yes,I talked to my mom about it a few weeks ago while we were home. I said she should be careful and not click links she doesn't know because I saw her click a link she shouldn't have.,1,Other (please specify),Family,Myself,No,At home,,"Personal experience (e.g., cybersecurity incident)",,"Application areas (web browsing, smartphone, social media etc.),Phishing or scams",,4,Helpful/responsible,,Because I was just trying to help.,Confident/informed,,Because she accepted my help.,Yes,,,,No,,,,,,,,,,,,,,,,,,,,,,,,36,Female,Portugal,Retail supervisor,2,5 (Strongly agree)
550,True,7/30/25 13:41,R_21v6pMIvqSHuyql,"50,9575","-0,5128",EN,"0,8999999762",68247ccc082cf829ea406f9c,Yes,"I was discussing the topic of the Stuxnet worm with a colleague at work.
We were talking about interesting and sophisticated hacks, the conversation was taking place during 2014, and Stuxnet came up. I'm pretty sure I had just watched a documentary or some video about it and shared the interesting details as part of the conversation.
We discussed the potential authors of the worm and who had the capability, agreeing that it had to have been state-sponsored. We talked about how it was impressive that it was very targeted and that it went undetected for such a long time at the Iranian facility. 
We talked about how it was able to get into an airgapped facility by probably a usb stick being dropped nearby. And how it was smart to go and find the machinery that spins the centrifuges and how it sped them up and then slowed them down, essentially preventing enrichment whilst going undetected for a long time.
The conversation lasted around 10 minutes, I think.",1,"Friend,Colleague",,,No,Workplace/University,,News story or social media post,,"Incidents (ransomware attack, data breach, leak, device theft etc.)",,4,"Interested/curious,Confident/informed",,"It was an interesting topic, but also because I remember I had recently watched a video on the topic which made me feel informed",Interested/curious,,The conversation was two way and continued for a while,No,,,,No,,,,,,,,,,,,,,,,,,,,,,,,36,Male,UK,Computer Science,3,5 (Strongly agree)
391,True,7/30/25 13:41,R_5OoIilDUwutSk8M,"42,2878","-71,3587",EN,"0,8999999762",6712b53345c966536d238e89,Yes,Not too long ago I had a conversation with my brother about cybersecurity. His credit card number had been stolen and I can relate to it because mine has been stolen in the past. We discussed how it might of happened and who he should call about it. I told him to call is credit card company to freeze the card and to get a new one. ,1,Other (please specify),Family,Myself,No,At home,,"Personal experience (e.g., cybersecurity incident),Someone asked for advice",,"Application areas (web browsing, smartphone, social media etc.),Identity theft or fraud,Incidents (ransomware attack, data breach, leak, device theft etc.),Phishing or scams,Privacy tools (permission manager, cookie banners etc.),Security behavior (choice of passwords, updating software etc.),Security tools (password managers, antivirus, VPN etc.)",,5 (Strongly agree),"Interested/curious,Worried/anxious,Confident/informed,Helpful/responsible",,Having experienced this before firsthand I wanted to help my brother out. ,"Interested/curious,Worried/anxious,Confident/informed,Helpful/responsible",,He understood what to do and had reassurance from me it could be fixed. ,Yes,Monitoring accounts more often and regularly changing passwords.,,,No,,,,,,,,,,,,,,,,,,,,,,,,37,Male,USA,Construction ,5 (Strongly agree),5 (Strongly agree)
252,True,7/30/25 13:42,R_8OTAinBqY1A1xNk,"52,4064","-1,5082",EN,"0,8000000119",5ae8226062c7f200018d67d7,Yes,Myself and my colleagues in our office. We were discussing a cyber breach at a university that resulted in emails being sent out with insulting names in the personalisation field. Someone had seen the university statement online which got us talking. The conversation probably lasted 5 minutes.,4,Colleague,,Other,No,Workplace/University,,News story or social media post,,"Application areas (web browsing, smartphone, social media etc.),Incidents (ransomware attack, data breach, leak, device theft etc.)",,4,Interested/curious,,I work at a university and i'd also seen an influencer post that she received one of the emails.,Interested/curious,,"Tone of conversation, we were interested and wanted to know how it had happened.",No,,,,No,,,,,,,,,,,,,,,,,,,,,,,,31,Female,UK,Marketing,1 (Strongly disagree),5 (Strongly agree)
579,True,7/30/25 13:42,R_8dFmolzuJOrpmYW,"55,9737","-3,2269",EN,"0,6999999881",6767e7f3e5207336bfda8591,Yes,"Local council had been hacked and schools had lost access to all of their systems, this caused major issues including problems with my child's exams, I discussed this with various people at various times over a few months. This topic is still ongoing being discussed regularly ",4,"Friend,Other (please specify)","Family, school staff ",,"Yes, somebody I know",At home,,Work/school-related requirement,,"Identity theft or fraud,Incidents (ransomware attack, data breach, leak, device theft etc.),Surveillance or data collection (government, companies etc.)",,2,"Worried/anxious,Annoyed",,"Annoyed by the situation it had put everyone in, worried about the longer term issues ","Worried/anxious,Annoyed,Helpful/responsible",,Same as myself re worried and annoyed. Responsible as they are part of the process ,,,,,No,,,,,,,,,,,,,,,,,,,,,,,,45,Female,Scotland ,Civil servant ,1 (Strongly disagree),5 (Strongly agree)
573,True,7/30/25 13:42,R_5j7Z6EsVRgjuddA,"40,6001","-73,7497",EN,"0,8999999762",65c23e2e1a96e23b93afdea0,Yes,"I was talking to my son at our house about a recent cyber attack on his computer, the conversation lasted about 10 minutes and in the end he said formatted his computer in order to fix the problem",1,Other (please specify),family,Other,No,At home,,"Personal experience (e.g., cybersecurity incident)",,"Incidents (ransomware attack, data breach, leak, device theft etc.)",,2,"Interested/curious,Worried/anxious",,I wanted to learn more how this happened and was worried that someone targeted him,Annoyed,,He did not like that experience,No,,,,No,,,,,,,,,,,,,,,,,,,,,,,,59,Male,United States,Home owner,1 (Strongly disagree),5 (Strongly agree)
411,True,7/30/25 13:43,R_8HoXhsi6fA8EM6c,"50,7797","-3,6527",EN,"0,8000000119",56abcb46f209e0000adab961,Yes,A friend had her email account hacked and was complaining about the inconvenience of having to try and and remember all the accounts it was associated with/the difficulty of changing her registered email address with some companies because they wanted to send confirmations to the hacked account that she no longer had access to. Initial conversation was probably about 5 minutes but was then referred to briefly in later conversations.,1,Friend,,Other,No,Other (please specify),friend's house,"Personal experience (e.g., cybersecurity incident)",,"Incidents (ransomware attack, data breach, leak, device theft etc.)",,3,Other (please describe),annoyed on her behalf,Because I can well imagine the pain it is to go through this.,"Worried/anxious,Annoyed",,Annoyed because of the stress/time involved; anxious in case it led to more than email being hacked.,No,,"Yes, I had (How many?)",2,No,,,,,,,,,,,,,,,,,,,,,,,,64,Female,UK,academic language editor,1 (Strongly disagree),5 (Strongly agree)
854,True,7/30/25 13:43,R_1pbbPvTbnrLxZQG,"39,9748","-82,8219",EN,"0,8000000119",66720d50c394601b811a0e49,Yes,I was on the phone with the Home Depot credit department that is managed by Citi for another issue and I mentioned that perhaps it was caused by the massive data breach that had just been reported. I mentioned to the customer service rep that the leak apparently included millions of Hotmail and Google credentials (including mine which were tied to this Home Depot account). The customer service rep locked down my account as a precaution until I could change all my passwords there and elsewhere. The conversation lasted about 23 minutes according to my cellphone history of the call. ,1,Stranger,,Myself,No,Other (please specify),Telephone call,"Personal experience (e.g., cybersecurity incident),News story or social media post",,"Application areas (web browsing, smartphone, social media etc.),Identity theft or fraud,Incidents (ransomware attack, data breach, leak, device theft etc.)",,5 (Strongly agree),"Interested/curious,Worried/anxious,Annoyed",,"I am more indifferent usually since hack, leaks and breaches are the status quo these day until it dawned on me that initial issue I called into the phone bank might be related to the massive data breach just reported in the news. Then I got agitated about it. ","Interested/curious,Helpful/responsible",,She hadn't heard news but was grateful for it and offered to lock down the account temporarily to make sure it wasn't being accessed illegally. Then she said she too would be changing her passwords as soon as possible. ,Yes,The account was locked down. And passwords were changed. ,,,No,,,,,,,,,,,,,,,,,,,,,,,,52,Male,United States of America,Project Manager,3,5 (Strongly agree)
557,True,7/30/25 13:44,R_8aK9rM3wdgwhEdj,"52,4891","13,4296",DE,"0,8999999762",671df4409cc481032b4fd9fc,Yes,"Ich habe mit meiner Mutter ein Gespräch darüber geführt, wie sie sich gegen Phishing-Versuche bzw. Versuche schützt, bei denen sie online betrogen werden soll. Das Gespräch hat via WhatsApp stattgefunden. Der Auslöser des Gesprächs war, dass ich bei WhatsApp meine Nummer geändert habe, da ich einen neuen Handyvertrag abgeschlossen habe. Dazu habe ich meiner Mutter geschrieben, dass ich eine neue Nummer habe und sie die gerne abspeichern soll. Auf diese Nachricht hat sie zunächst nicht geantwortet, sondern sie auf ""gelesen"" gelassen. Erst später habe ich dann von meiner Freundin erfahren, dass meine Mutter sie kontaktiert hat, um nachzufragen, ob ich wirklich eine neue Nummer habe und das alles seine Richtigkeit hat. Danach hat sie mir dann wieder geschrieben und sich für die neue Nummer bedankt. Im Anschluss haben wir dann ein bisschen darüber gesprochen, dass ich stolz auf sie bin, dass sie so gehandelt hat und wie einfach es mittlerweile ist, durch solche Tricks betrogen zu werden, gerade weil wir uns öfter Geld hin und her schicken und das meist vorher via WhatsApp besprechen. Das Gespräch hat alles in allem nur wenige Minuten gedauert (ca. 10 ausgetauschte Chat-Nachrichten).",2,Other (please specify),Mutter,Myself,No,Other (please specify),WhatsApp,"Personal experience (e.g., cybersecurity incident)",,"Identity theft or fraud,Phishing or scams,Other (please specify)","Verhalten bei Betrugsversuchen via WhatsApp (""Enkeltrick"")",4,"Interested/curious,Helpful/responsible",,"Ich fand es interessant, mich darüber mit meiner Mutter auszutauschen und herauszufinden, welche Erfahren sie selbst schon hat, obwohl sie kein Digital Native ist.",Confident/informed,,"Ich denke meine Mutter war stolz darauf, dass sie sich selbstständig so gut gegen ""Angriffe"" schützt und hat sich vermutlich gefreut, dass sie von mir gelobt wurde, da ich in diesem Bereich beruflich tätig bin.",No,,,,No,,,,,,,,,,,,,,,,,,,,,,,,31,Male,Deutschland,Senior Fullstack Developer (Web-Entwicklung),4,5 (Strongly agree)
564,True,7/30/25 13:44,R_1eajmS9FrNw8Otq,"38,7893","-104,8221",EN,"0,8999999762",66d4712f340d9f18e186d041,Yes,"It was a co worker before a meeting. We were in the break room because it was the only room big enough for as many people were in the meeting. 
They talked about they started using an app on their phone that stores passwords and syncs with their computer so they don't have to remember anything. 
He was fiddling with his phone trying to turn off something and I asked if he was going for a new high score as a joke. They were trying to turn the app off because it sends notifications and he can't figure out how to mute them so he turns his phone on airplane mode. 
It was a minute maybe? Pretty casual convo, nothing serious. ",2,Colleague,,Myself,"Yes, somebody I know",Workplace/University,,Other (please specify),small talk turned into a little more substance ,"Security behavior (choice of passwords, updating software etc.),Security tools (password managers, antivirus, VPN etc.)",,3,Interested/curious,,"I made the comment that started the convo, that means I have a responsibility to the person to at least pretend I am interested if they engage. ","Worried/anxious,Confident/informed",,They said they were worrying about their phone but then were clearly excited about the app and wanted to share. ,No,,,,No,,,,,,,,,,,,,,,,,,,,,,,,47,Male,USA,I work in retail/wholesale my education is in Sociology and Psychology. ,2,5 (Strongly agree)
219,True,7/30/25 13:44,R_8xX0QELuCulAihM,"54,58","-5,928",EN,"0,8999999762",66e7381b679a09a5e859d755,Yes,I was talking to my wife about cyber security as there was an attempted fraud on our shared bank account. The conversation lasted about 10 mins and we got in touch with the bank fraud team,2,Other (please specify),spouse,Myself,No,At home,,"Personal experience (e.g., cybersecurity incident)",,Identity theft or fraud,,5 (Strongly agree),Helpful/responsible,,I knew what we needed to do,Worried/anxious,,They weren't best sure how to rectify the situation,Yes,we changed our bank cards and the security settings on our account,,,No,,,,,,,,,,,,,,,,,,,,,,,,38,Male,northern ireland,retail,3,5 (Strongly agree)
